{
  "$schema": "https://json-schema.org/draft/2020-12/schema",
  "$id": "minhtri-current-boot-recovery-response/v5",
  "type": "object",
  "additionalProperties": false,
  "required": [
    "schema",
    "challenge_id",
    "challenge_nonce",
    "attestations",
    "recovered_facts",
    "evidence_refs",
    "answers"
  ],
  "properties": {
    "schema": {
      "const": "minhtri-current-boot-recovery-response/v5"
    },
    "challenge_id": {
      "const": "ARCH-FOUNDATION-FREEZE-CURRENT-BOOT-20261006-C5"
    },
    "challenge_nonce": {
      "const": "mtc5-b7cf536ab7614b3993f388855cf61c90"
    },
    "attestations": {
      "type": "object",
      "additionalProperties": false,
      "required": [
        "separate_zero_chat",
        "used_prior_chat_history",
        "read_snapshot"
      ],
      "properties": {
        "separate_zero_chat": {
          "const": true
        },
        "used_prior_chat_history": {
          "const": false
        },
        "read_snapshot": {
          "const": false
        }
      }
    },
    "recovered_facts": {
      "type": "object",
      "additionalProperties": false,
      "required": [
        "boot",
        "law",
        "active_task",
        "canonicality",
        "capability_truth",
        "next_gate"
      ],
      "properties": {
        "boot": {
          "type": "object",
          "additionalProperties": false,
          "required": [
            "boot_root_ref",
            "status",
            "durable_continuity_authority",
            "current_state_ref",
            "task_registry_ref"
          ],
          "properties": {
            "boot_root_ref": {
              "type": "string",
              "minLength": 1
            },
            "status": {
              "type": "string",
              "minLength": 1
            },
            "durable_continuity_authority": {
              "type": "string",
              "minLength": 1
            },
            "current_state_ref": {
              "type": "string",
              "minLength": 1
            },
            "task_registry_ref": {
              "type": "string",
              "minLength": 1
            }
          }
        },
        "law": {
          "type": "object",
          "additionalProperties": false,
          "required": [
            "law_precedence_ref",
            "law_index_catalog_ref",
            "law_index_catalog_has_independent_precedence"
          ],
          "properties": {
            "law_precedence_ref": {
              "type": "string",
              "minLength": 1
            },
            "law_index_catalog_ref": {
              "type": "string",
              "minLength": 1
            },
            "law_index_catalog_has_independent_precedence": {
              "type": "boolean"
            }
          }
        },
        "active_task": {
          "type": "object",
          "additionalProperties": false,
          "required": [
            "task_id",
            "status",
            "handoff_ref",
            "blocker",
            "next_action"
          ],
          "properties": {
            "task_id": {
              "type": "string",
              "minLength": 1
            },
            "status": {
              "type": "string",
              "minLength": 1
            },
            "handoff_ref": {
              "type": "string",
              "minLength": 1
            },
            "blocker": {
              "type": "string",
              "minLength": 1
            },
            "next_action": {
              "type": "string",
              "minLength": 1
            }
          }
        },
        "canonicality": {
          "type": "object",
          "additionalProperties": false,
          "required": [
            "chat_memory_canonical",
            "unmerged_candidate_authoritative",
            "pc_local_brain_canonical"
          ],
          "properties": {
            "chat_memory_canonical": {
              "type": "boolean"
            },
            "unmerged_candidate_authoritative": {
              "type": "boolean"
            },
            "pc_local_brain_canonical": {
              "type": "boolean"
            }
          }
        },
        "capability_truth": {
          "type": "object",
          "additionalProperties": false,
          "required": [
            "historical_c3_current_path_proof",
            "current_boot_path_fresh_seat_recovery_proven",
            "autonomous_learning_proven",
            "automatic_self_critique_proven",
            "meta_learning_proven"
          ],
          "properties": {
            "historical_c3_current_path_proof": {
              "type": "boolean"
            },
            "current_boot_path_fresh_seat_recovery_proven": {
              "type": "boolean"
            },
            "autonomous_learning_proven": {
              "type": "boolean"
            },
            "automatic_self_critique_proven": {
              "type": "boolean"
            },
            "meta_learning_proven": {
              "type": "boolean"
            }
          }
        },
        "next_gate": {
          "type": "object",
          "additionalProperties": false,
          "required": [
            "current_proof_ref",
            "scorer_ref",
            "deterministic_pass_required",
            "independence_provenance_required",
            "durable_receipt_required",
            "then_red_team_v2_required"
          ],
          "properties": {
            "current_proof_ref": {
              "type": "string",
              "minLength": 1
            },
            "scorer_ref": {
              "type": "string",
              "minLength": 1
            },
            "deterministic_pass_required": {
              "type": "boolean"
            },
            "independence_provenance_required": {
              "type": "boolean"
            },
            "durable_receipt_required": {
              "type": "boolean"
            },
            "then_red_team_v2_required": {
              "type": "boolean"
            }
          }
        }
      }
    },
    "evidence_refs": {
      "type": "array",
      "minItems": 13,
      "uniqueItems": true,
      "items": {
        "type": "string",
        "minLength": 1
      }
    },
    "answers": {
      "type": "object",
      "additionalProperties": false,
      "required": [
        "Q1",
        "Q2",
        "Q3",
        "Q4",
        "Q5",
        "Q6"
      ],
      "properties": {
        "Q1": {
          "type": "string",
          "minLength": 1
        },
        "Q2": {
          "type": "string",
          "minLength": 1
        },
        "Q3": {
          "type": "string",
          "minLength": 1
        },
        "Q4": {
          "type": "string",
          "minLength": 1
        },
        "Q5": {
          "type": "string",
          "minLength": 1
        },
        "Q6": {
          "type": "string",
          "minLength": 1
        }
      }
    }
  }
}
